,title,artist,lyric,genre
212,"꽃비 내리던 날 (Feat. 이내경, 이승훈)",아매 프로젝트,"꽃비 내리던 날 내게 와줘서 고마워
세상 끝날까지 온 맘 다해
오직 너만 바라보고 사랑할게
꽃비 내리던 날 하나가 되었던 우리 음음
영원에서 영원으로 함께 가는 서로의 반쪽이 됐지
꽃비 내리던 날 꽃비 내리는 날 우후후
꽃비 맞으며 걸어가던 널 보는 순간 심장이 멎을 뻔했어
세상의 언어로는 표현할 수 없는 아름다움
꽃이 네 앞에선 이름 모를 들꽃 일 뿐이야
꿈을 꾸듯 하늘을 사뿐사뿐 날아 네게로 갔지
깜짝 놀라 멈칫하던 나를 향해 미소 지었지
꽃비에 흠뻑 젖은 나를 바라보던 그 눈빛에

꽃비 내리던 날 내게 와줘서 고마워
세상 끝날까지 온 맘 다해 오직 너만 바라보고 사랑할게
꽃비 내리던 날 하나가 되었던 우리 음음
영원에서 영원으로 함께 가는 서로의 반쪽이 됐지
꽃비 내리던 날 꽃비 내리는 날 우후후
설레는 내 마음 하늘로 두둥실 떠올라
너만 바라보는 하나의 별이 되어 늘 곁에 있었지
이젠 너의 내가 아닌 난 아무런 (의미가 없어)
너의 향기에 취해 나도 모르게 (스르르 몸을 기대)
너와 함께 꿈을 꾸는 (영혼이 되었지)
우리는 사랑으로 이루어진 인연

꽃비 내리던 날 내게 와줘서 고마워
세상 끝날까지 온 맘 다해 오직 너만 바라보고 사랑할게
꽃비 내리던 날 하나가 되었던 우리 음음
영원에서 영원으로 함께 가는 서로의 반쪽이 됐지
꽃비 내리던 날 꽃비 내리는 날 우후후",balad
213,일오사일,뱁영규,"너는 그저 심심할 때만 찾아와서
네 얘기를 들려줘

나는 그런 너를 기다리다가
내 일상이 전부 무너져

우린 뭘까
아니 나는 뭘까
우린 얼마나 같이 놀까

급하게 날 찾아온 넌
내 마음을 두드려
많은 말들 사이로

여기서 넌 항상
네 맑음을 보여줬지
많지 않은 나이로

꿈에서도 너의 모습이 보여

난 그저 여기 서있어
난 그저 네가 오길 기다려

또 한 명의 사람이 지나가요
너라는 바람이 부나 봐요

너를 향한 신호음이 삡삡
전신주를 타고 내 마음이 네게 직진

들을 수밖에 없는 난
그럴 수밖에 없었다

광고 전화
내가 걸었다

목소리가 듣고 싶어 이번 한 번만
아주 잠깐이라도 좋아

대화를 나눌 수만 있다면
나는 너와

하고 싶은 말이 많아
듣기만 해도 난 좋아

하지만 안 받을 걸 알아

난 그저 여기 서있어
난 그저 네가 오길 기다려

난 그저 여기 서있어
난 그저 네가 오길 기다려",balad
214,아니길,전국영,"그 많은 지난 시간들
나 홀로 어찌 감당해야해요
이제는 지울 수 없는 깊은 상처들은
남겨진 나만의 것일 뿐

미친듯 울고 있네요
생각조차 할 수 없었던 안녕
별처럼 수없이 쏟아지던 그 사랑도
비처럼 그치고 말았죠

아니길
제발 되돌려줘요
잠시 미친거야
이럴 수는 없잖아
나이길
제발 되돌려줘요
그 사람 곁에서 행복한 나를 떠올릴 수 없어요

미친듯 울고 있네요
생각조차 할 수 없었던 안녕
봄처럼 조용히 찾아왔던 그 사랑도
눈처럼 사라져 버렸죠

아니길
제발 되돌려줘요
잠시 미친거야
이럴 수는 없잖아
나이길
제발 되돌려줘요
그 사람 함께한 기억만으론 버틸 수가 없어요

아니길
제발 되돌려줘요
잠시 미친거야
이럴 수는 없잖아
나이길
제발 되돌려줘요
그 사람 곁에서 머무는 사랑 나일 것만 같아요",balad
215,다시 만나자 우리,이들 (Edle),"안녕 우리 오늘도
매일 다르지 않은 날처럼
웃으면서 인사하기로 해

애써 꺼낸 말속에
담긴 작은 울먹임
모른척해주기로 해

긴 꿈을 꾸던 우리
같은 곳을 보던 날
그것만 기억해

Like a star
언제라도 반짝이던
그런 소중한 날들이 있어

늘 기억 속에 영원토록 남아
또 다시 만나자 우리

꼭 끌어안던 우리
잠시 멀어진대도
그것만 기억해

Like a star
언제라도 반짝이던
그런 소중한 날들이 있어

늘 여기 함께 오래도록 남아
또 다시 만나자 우리",balad
216,You Know,R2&2R,"Can't fight these feelings now,
I've tried but they come back around every time
It's like I can't go anywhere without you on my mind
And you think I'd be a little better by now but I know I can't hide it

And I wish I could put a poker face on
Want our friends all bring you up and
when I hear a song wish I could keep it on
Oh I wish that I could just bite my tongue
when I get home I want to call you up but
I can't fight it cuz
you know you know you know
I'm about to lie
You know you know you know
can't fight it can't hide it even onesided
Oh oh you know you know you know
I'm better lying

I can't stand this
Ever since I haven't had you around it's too loud
and I still can see your face out in the crowd
Yeah you think I'd be with someone else by now but I I'd be lying
Oh I wish I could finally turn the switch up
so the memories would all be gone and
when I hear a song wish I could keep it on
oh I wish I would just turn off my phone
when I get home I want to call you up but
I can't hide it cuz
you know you know you know
I'm about to lie
You know you know you know
oh you know you know you know
can't fight it can't hide it even though it's onesided
Yeah you know you know you know
I'm about to lie
you know you know you know
yeah you know you know you know
I'm bad liying I'm bad liying I'm bad liying

oh and I wish I could put a poker face on
when our friends all bring you up and
when I hear a song wish I could keep it on
oh I wish that I could just bite my tongue
when I get home I want to call you up but I can't fight it

Cuz you know you know you know I'm about liying
you know you know you know
oh you know you know you know
can't fight it can't hide it even though it's onesided",balad
217,4월은 거짓말,늑대와 카사블랑카,"이번엔 화려한 시작일까
하루아침에 바뀔 리 없지만
기분은 그런 느낌에
색다른 것 같은 인사말과
표정이 다를 거란 확신을 만들게 했어
나를 설레게

자연스럽게 머릿속에 멜로디가
재생되고 그려지는 장면 하나가
이끌어 줬던 거야 분명히 그러니까
이뤄질 수밖에 없는 전개야 못 막아 날

하루는 가볍게 카페지 너는 라떼를 골랐고
당연히 같은 걸로
침묵은 감성적, 자연스러운 느낌 또한
장식해 줄 거야 우리 커피의 향도

눈이 맞는 건 아직도 떨려 살짝 피하면
웃어주는 건 반칙이야 머릿속이 녹아서
오늘의 커피향이 기억나지 않는 건
당연한 걸까 쓸 일기엔 네 얘기뿐

점점 채워지는 하나뿐인 것
담담하지 못하게 하는 유일한 넌
잠에 들게 하지 못하게 해
꿈 속인 것만 같아 나의 현실은

하루하루를 허투루 보내지 못하게 해
짧은 것 같은 나날을 억지로 길게 하길
날들의 향기를 모두 담아둘 수 있게

너와의 4월은 ゆらゆらふわで
태양조차 금세 떨어지고 마는데
그렇다면 좀 더 ふわふわゆられ
다른 것들은 기억하지도 못하게
춤추거라

꽃잎 하나라도 남았을 때
그 순간순간을 놓칠 순 없기에
사실은 시작되지도 않은 이야기가
거짓말이란 결말로 끝낼 수는 없기에

전부 거짓말인 듯이
하루하루를 아무것도 아니게
만들 순 없기에

하루는 공원 벤치에서 너는 잠깐 쉬기로 했고
물론 나도 좋지요
산들거리는 바람이 나른 거리게 만들어 주니
긴장까지 줄어 들었고

우선 가볍게 이름을 부르니 고개 돌려
대답하죠 잠깐, 뭐라 할지 까먹었어
난 간단하게 마음만 전할 뿐
잠깐의 침묵이 몇 초였나 너무나 길더라고

자, 써볼까 오늘의 이야기는 날
바뀌게 만들 거야 결과는 너와 나
둘만이 알 거야 어땠는지
아직까지 떨리는 것 같아
손마디까지도

하루하루를 허투루 보내지 못하게 해
짧은 것 같은 나날을 억지로 길게 하길
날들의 향기를 모두 담아둘 수 있길

아지랑이 보이는 눈앞에 풍경은
매 장면을 꿈같게 해 일어날까 봐 무섭게
아무렇지 않은 듯 내게 다가오면
아, 바보구나 이렇게 심장이 떨릴 수 없네

소리 없이 맴도는 생각이 방해돼
단지 지금을 즐기고 모든 걸 기억하면 돼
발걸음이 가볍구나 오늘의 이 길은
짧은 듯 좀 길었네 아직도 멀어 보이니

너와의 4월은 ゆらゆらふわで
태양조차 금세 떨어지고 마는데
그렇다면 계속 ふわふわゆられ
다른 것들은 기억하지도 못하게
춤추거라

꽃잎 하나라도 남았을 때
그 순간순간을 놓칠 순 없기에
지금 바로 시작된 우리 이야기가
거짓말이란 결말로 끝낼 수는 없기에

너와의 4월은 ゆらゆらふわで
태양조차 금세 떨어지고 마는데
그렇게 영원히 ふわふわゆられ
다른 것들은 기억하지도 못하게
춤추거라

꽃잎 하나라도 남았을 때
그 순간순간을 놓칠 순 없기에
모든 게 확실하지 않은 이 이야기가
거짓말이란 결말로 끝낼 수는 없기에

전부 거짓말인 듯이
그래, 이제까지의 이야기가
거짓말인 듯이 늘",balad
218,IN MY HEART,에일린,"Baby, I miss you so much
I need you by my side
I’ll see you one sweet day
Baby, always think of you
Some days, they feel so blue
You were the brightest star

You’re gonna be on my mind
All the time, baby
Now that you’re gone
I feel down and I can’t help it
I promise you’ll always be In my heart, Pinko

Baby, know this one’s for you
I’ll miss you ’cause you were
The reason why I’d smile
Sweetie, always in my thoughts
I’m gonna write a song
You would have danced along

You’re gonna be on my mind
All the time, baby
Now that you’re gone
I feel down and I can’t help it
I miss you so, day and night
Wish you were with me
I promise you’ll always be In my heart, Pinko


Heaven’s gates, they opened
My sweetest friend, my sweetest...
You’re a light in the sky

You’re gonna be on my mind
All the time, baby
Now that you’re gone
I feel down and I can’t help it
I miss you so, day and night
Wish you were with me
I promise you’ll always be In my heart, Pinko",balad
219,겁쟁이의 짝사랑,상수역 1번 출구,"멀리서 그대 올까 창문 열고 발자국 소리 듣고
새벽까지 그대 편지 써요 전하지도 못하는 편지들

고요한 이 시간에 내 마음만 소란스러운가
가만있지 못해 왜 이러죠 심장소리 크게 들려오죠

다시 심란해진 내 마음 구름 속 달처럼
그대 눈빛이 가리워져 내 맘 바라볼 수 없네요

가슴이 간지러워 사랑이 날 쏘고 달아났나 봐
그대 웃음 한번 보여주면 날아갈 듯 괜찮아질 텐데

다시 심란해진 내 마음 구름 속 달처럼
그대 눈빛이 가리워져 내 맘 바라볼 수 없네요

그래 못난 나를 알아요 한마디 못하죠
매일 밤 나는 다짐하죠 내일 바로 고백하는 나",balad
220,Damage,이의열,"Forgiveness is better than Revenge

니가 원하는 게 뭐야 니가 바라는 게 뭐야
지금까지 날 가지고 논 기분이 들어
어떤 방식으로도 널 용서하지 않을거야
내 앞에서 널 부숴버리고 말거야

날 변하게 했어 너란 여자가
아무 감정조차 느낄 수 가 없도록
오 나는 믿었어 너의 순진한 눈빛을
내가 받은걸 네게 갚아 줄거야

I Got a Damage 돌아가고 싶어
Oh! Damage 난 잊고 싶어
Oh! Damage 잊을 수 가 없어
아직도 널 사랑하나봐

I Got a Damage 정말 미치겠어
Oh Damage 숨 쉴 수가 없어
Oh Damage 너 없이는 한 순간도
숨 쉴 수가 없는 나


내 자신을 탓해 봐도 지난 일을 후회해도
돌이킬 수 없는 시간에 또 후회을 해
무슨 짓을 해서라도 갚아주고 말거라고
셀 수 없을 만큼 기억 속에 너를 죽여

날 변하게 했어 너란 여자가
아무 감정조차 느낄 수 가 없도록
오 나는 믿었어 너의 순진한 눈빛을
내가 받은걸 네게 갚아 줄 거야

I Got a Damage 돌아가고 싶어
Oh Damage 난 잊고 싶어
Oh Damage 잊을 수 가 없어
아직도 널 사랑하나봐

I Got a Damage 정말 미치겠어
Oh Damage 숨 쉴 수가 없어
Oh Damage 너 없이는 한 순간도
숨 쉴 수가 없는 나


내가 그리 우습게 보였나봐
니 멋대로 이용하려고 했어
난 모든 받고 싶었어 내 인생을
망가뜨린 널 만난 댓가가 필요하니깐

I Got a Damage oh oh
Damage ah ah ah Damage ah ah

I Got a Damage 정말 미치겠어
Oh Damage 숨 쉴 수가 없어
Oh Damage 너 없이는 한 순간도
숨 쉴 수가 없는 나

I Got a Damage 다시 돌아와줘
Oh Damage 내게 기회를 줘
Oh Damage 사랑했던 나를 잔인하게
버릴 수 있니

I Got a Damage 다시 안고싶어
Oh Damage 너를 갖고싶어
Oh Damage 너 아니면 다른
사랑조차 할 없는 나

I Got a Damage",balad
221,이제 다 지난 일,닐버드 (NILBUD),"그대 얼굴이 다 지워질 때쯤
가까스로 내 맘도 멈췄죠
하루하루 흘려보내고 나니
힘들었던 일들도 기억 안 나요

그댄 잘 지내나요
그땐 왜 그랬었나요
묻고 싶고 따지고 싶지만 (화내고 싶지만)
이제 다 지난 일

어제 그곳에서 그댈 보았죠
그대와 종종 갔던 카페
하지만 내 손엔
그대 아닌 다른 사람이
난 이렇게 잘 지내고 있어요

그댄 잘 지내나요
그땐 왜 그랬었나요
묻고 싶고 따지고 싶지만 (화내고 싶지만)
이제 다 지난 일

그댄 잘 지냈어야죠
그땐 날 놓았잖아요
잡지도 말고 울지도 말라면서 (차갑게)
왜 그렇게 힘든가요

이미 다 지나버린 일
이제 다 지난 일",balad
222,Psycho,볼빨간사춘기,"널 어쩌면 좋을까
이런 맘은 또 첨이라
Up & Down이 좀 심해
조절이 자꾸 잘 안돼
하나 확실한 건
I don’t play the game

우리 진짜 별나대
그냥 내가 너무 좋아해
넌 그걸 너무 잘 알고
날 쥐락펴락해
나도 마찬가지인걸

우린 참 별나고 이상한 사이야
서로를 부서지게
그리곤 또 껴안아

You got me feeling like a psycho psycho
우릴 보고 말해 자꾸 자꾸
다시 안 볼 듯 싸우다가도
붙어 다니니 말야
이해가 안 간대
웃기지도 않대

맞아 Psycho psycho
서로 좋아 죽는 바보 바보
너 없인 어지럽고 슬퍼져
기운도 막 없어요
둘이 잘 만났대
Hey now we’ll be ok

Hey trouble
경고 따윈 없이 오는 너
I’m original visual
우린 원래 이랬어 Yeah
두렵지는 않아 (흥미로울 뿐)
It’s hot! Let me just hop
어떻게 널 다룰까?

어쩔 줄을 몰라 너를 달래고
매섭게 발로 차도
가끔 내게 미소 짓는 널
어떻게 놓겠어 Ooh

우린 아름답고 참 슬픈 사이야
서로를 빛나게 해
마치 달과 강처럼
그리곤 또 껴안아

You got me feeling like a psycho psycho
우릴 보고 말해 자꾸 자꾸
다시 안 볼 듯 싸우다가도
붙어 다니니 말야
이해가 안 간대
웃기지도 않대

맞아 Psycho psycho
서로 좋아 죽는 바보 바보
너 없인 어지럽고 슬퍼져
기운도 막 없어요
둘이 잘 만났대
Hey now we’ll be ok

Don’t look back
그렇게 우리답게 가보자
난 온몸으로 널 느끼고 있어
Everything will be ok

You got me feeling like a psycho psycho
우릴 보고 말해 자꾸 자꾸
다시 안 볼 듯 싸우다가도
붙어 다니니 말야
이해가 안 간대
웃기지도 않대

맞아 Psycho psycho
서로 좋아 죽는 바보 바보
너 없인 어지럽고 슬퍼져
기운도 막 없어요
둘이 잘 만났대
Hey now we’ll be ok",balad
223,그 사람,이우,"내가 아닌 다른 사람을
사랑하고 있는 널 보며
내 마음이 얼마나 아팠었는지
넌 아마도 모를 거야

비 내리던 밤 전화 넘어
취한듯한 너의 목소리
남잔 왜 그래 울먹이는 너의 말에
위로하는 내 모습은 내가 봐도 서글퍼

그 사람보다 내가 널 더 사랑하는데
왜 난 너에게 편한 사람 거기까지 인 건지
그 사람보다 내가 널 더 사랑한다고
내 마음을 몰라주는 너에게 고백하고 싶어

그 사람이 너를 정말 사랑한다면
누구보다 행복하게 해줘야 하잖아
왜 널 아프게 해 왜 널 힘들게 해
내겐 네가 무엇보다 제일 소중한데

그 사람보다 내가 널 더 사랑하는데
왜 난 너에게 편한 사람 거기까지 인 건지
그 사람보다 내가 널 더 사랑한다고
내 마음을 몰라주는 너에게 고백하고 싶어

꽤 오랫동안 기다려왔어
괜히 어색해질까 봐 겁이 났어
이제는 더 이상 못 참겠어
내가 너의 남자이고 싶어

그 사람 잊고 이젠 내 마음 받아주면 돼
너 하나만 바라보는 내가 여기 있잖아
그 누구보다 내가 너를 사랑한다고
내 마음을 몰라주는 너에게 고백하고 싶어

내가 너를 사랑한다고",balad
224,칵테일 사랑,경서,"마음 울적한 날엔 거리를 걸어보고
향기로운 칵테일에 취해도 보고
한 편의 시가 있는 전시회장도 가고
밤새도록 그리움에 편질 쓰고파

모차르트 피아노 협주곡 21번
그 음악을 내 귓가에 속삭여주며
아침햇살 눈부심에 나를 깨워줄
그런 연인이 내게 있으면

나는 아직 순수함을 느끼고 싶어
어느 작은 우체국 앞 계단에 앉아
프리지아 꽃향기를 내게 안겨줄
그런 연인을 만나봤으면

마음 울적한 날엔 거리를 걸어보고
향기로운 칵테일에 취해도 보고
한 편의 시가 있는 전시회장도 가고
밤새도록 그리움에 편질 쓰고파

모차르트 피아노 협주곡 21번
그 음악을 내 귓가에 속삭여주며
아침햇살 눈부심에 나를 깨워줄
그런 연인이 내게 있으면

나는 아직 순수함을 느끼고 싶어
어느 작은 우체국 앞 계단에 앉아
프리지아 꽃향기를 내게 안겨줄
그런 연인을 만나봤으면

마음 울적한 날엔 거리를 걸어보고
향기로운 칵테일에 취해도 보고
한 편의 시가 있는 전시회장도 가고
밤새도록 그리움에 편질 쓰고파

창밖에는 우울한 비가 내리고 있어
내 마음도 그 비 따라 우울해지네
누가 내게 눈부신 사랑을 가져줄까
이 세상은 나로 인해 아름다운데

마음 울적한 날엔 거리를 걸어보고
향기로운 칵테일에 취해도 보고
한 편의 시가 있는 전시회장도 가고
밤새도록 그리움에 편질 쓰고파",balad
225,하고 싶던 말,후아유,"오늘도 내일도 그대 모습 그리죠
하루를 그대만 기다리는데
매일 밤 수백 번 생각해 봐도
아직 말하기가 내겐 어려운데

너를 사랑하기엔 아직 내가
너에게 부족한 거야
매일 가슴 졸이며 생각하던
너에게 꼭 하고 싶던 말

사랑한다고
좋아한다고
너만 보면 내 심장이 뛰는 걸
말할 수 있어
너에게로 다가가
Oh baby your my love
I'm ready for your love

오늘도 달빛에 그대 모습 그리죠
저 멀리 그대만 바라보는데
매일 밤 수백 번 생각해 봐도
아직 말하기가 내겐 어려운데

너를 사랑하기엔 아직 내가
너에게 부족한 거야
매일 가슴 졸이며 생각하던
너에게 꼭 하고 싶던 말

사랑한다고
좋아한다고
너만 보면 내 심장이 뛰는 걸
말할 수 있어
너에게로 다가가
Oh baby your my love
I'm ready for your love

잠이 들기 전에 네 생각이 나겠지
너의 웃음 짓는 모습이
내일은 말할래
너에게 다가가 사랑해

사랑한다고
좋아한다고
너를 보면 내 심장이 뛰는 걸
말하고 싶어
너에게로 다가가
Oh baby your my love
I'm ready for your love",balad
226,4월의 눈,전상근,"혼자란 게 그리 나쁘진 않아
외롭단 것도 퍽 괜찮을 때도 있으니까 난
난 괜찮아 보여
이제는 걱정 안 해도 돼
놓쳐버린 보통의 날들을 그리워하고
한 줌의 기대가 올 때마다
애를 써 울어버렸어
한동안 괜찮아지니까
4월에 내린 눈을 볼 때면
그렇게 네가 떠올라
그날의 아픈 우리가
매일 따뜻해서 생각지도 못했던
시리도록 차갑던 그날의 밤
날 붙잡으려 애를 쓰는 너, 비겁한 나
서둘러서 맘에 남아있는 너를 털어내고
길었던 날들에 인사를 해
또 아무렇지 않은 것처럼 잘 지내다
4월에 내린 눈을 볼 때면
그렇게 네가 떠올라
그날의 아픈 우리가
매일 따뜻해서 생각지도 못했던
시리도록 차갑던 그날의 난
너를 붙잡으려 해
참 오래 걸렸지 이런 얘기
듣고 싶지 않을까 봐
아직도 난 너무 아파
여전히 이기적인 나라서 미안
돌아갈 수 없단 걸 알면서도
4월에 내릴 눈을 기다려 그곳에서",balad
227,여기서 헤어지면 정말 이별일까 봐,윤원,"또 다른 길에 서있는 우리
어쩌다 너와 난
이렇게 아픈 사이가 됐는지
모르겠어 정말
나의 마지막 사랑이라고
그렇게 믿어왔는데
아니었던 걸까
우리 여기서 헤어지면
정말 이별인 것 같아서
안되는데 이건 정말로
말이 안 되는 일인데
너보다 내가 더 사랑해서
미친 듯이 너를 원하고
널 사랑한다는 말도 못 했어
모르겠어 정말
나의 마지막 사랑이라고
그렇게 믿어왔는데
아니었던 걸까
우리 여기서 헤어지면
정말 이별인 것 같아서
안되는데 이건 정말로
말이 안 되는 일인데
너보다 내가 더 사랑해서
미친 듯이 너를 원하고
널 사랑한다는 말도 못 했어
유난히 길었던 하루
쉽게 잠들지 못하고
너를 그리고 있어
우리 여기서 헤어지면
정말 이별인 것 같아서
안되는데 이건 정말로
말이 안 되는 일인데
너보다 내가 더 사랑해서
미친 듯이 너를 원하고
널 사랑한다는 말도 못 했어
이별까지는 나는 못하겠어",balad
228,LAVA,GYUNA,"I can’t take another lonely night
You know that I need you more
You know that I need you more (yeah)
I’m not giving in without a fight
I’m ready to crash and roar
I’m crumbling down the door

Another night
Imma take it all, now or never
Coming alive
Like I want you more, I want you more
I’ll survive, no I’m not giving in, it’s over
Don’t you know you’re driving me wild
(Like lava)
Brighter, shining brighter than the city
With you running there beside me, come alive
(Like lava)
Higher, getting higher than the heavens
I won’t wait another second, come alive
(Like lava)

Heart beat like you’re getting it all
I’ll catch you whenever you fall
I break through when you’re hitting a wall
(I’ll give you lava)

Concrete, and I’m giving it all
You catch me whenever I fall
Come running whenever I call
(I’ll give you lava)

Baby, I am in your orbit
Tell me this is how you want it
I can’t wait another moment
Now my eyes are wide open
All the stars they can align
When you put your hand in mine
Now I know that it’s our time

Another night
Imma take it all, now or never
Coming alive
Like I want you more, I want you more
I’ll survive, no I’m not giving in, it’s over
Don’t you know you’re driving me wild
(Like lava)
Brighter, shining brighter than the city
With you running there beside me, come alive
(Like lava)
Higher, getting higher than the heavens
I won’t wait another second, come alive
(Like lava)
Heart beat like you’re getting it all
I’ll catch you whenever you fall
I break through when you’re hitting a wall
(I’ll give you lava)

Concrete, and I’m giving it all
You catch me whenever I fall
Come running whenever I call
(I’ll give you lava)",balad
229,익숙할 리 없잖아요,리디아 (Lydia),"사랑했었다고 말하지 말아요 이별은 한순간에 날 무너뜨리니까
아무렇지 않을 그대처럼 강하지 않아요
조금만 천천히 떠나가줘요

닳고 닳은 마음뿐인 나의 모습에 너는 날 숨 쉬게 했고 날 웃게 해줬어
늘 원하고 원해도 내겐 모자라던 너의 사랑이
결국엔 이렇게 내 곁을 떠나 가네

한 번쯤 그대도 이렇게 지치고 지쳐서 주저했을까 힘이 들었을까
이제 와서 그대의 마음을 헤아려보려 해도
부족한 내 모습에 더 미안해져

닳고 닳은 마음뿐인 나의 모습에 너는 날 숨 쉬게 했고 날 웃게 해줬어
늘 원하고 원해도 내겐 모자라던 너의 사랑이
결국엔 이렇게 내 곁을 떠나 가네

헤어짐이 익숙할 리 없잖아요 아무리 후회해도 되돌릴 수는 없어

보고 파도 그리워도 더 참아볼게 그것만이 그대에게 해줄 수 있는 일
미안했다고 아직도 널 많이 그리워한다고
다 지나간 우리 사랑에게 말해",balad
